{
  "$schema": "https://json-schema.org/draft/2020-12/schema",
  "$id": "dd-eval/assessment@1",
  "type": "object",
  "required": ["schema_id", "case_id", "status", "scopes"],
  "properties": {
    "schema_id": {"const": "dd-eval/assessment@1"},
    "case_id": {"type": "string"},
    "status": {"const": "accepted"},
    "scopes": {"type": "object"}
  },
  "additionalProperties": false
}
